{
  "$schema": "https://raw.githubusercontent.com/elicore/redis-web/main/webdis.schema.json",
  "redis_host": "127.0.0.1",
  "redis_port": 6379,
  "http_host": "0.0.0.0",
  "http_port": 7379,
  "http_threads": 4,
  "pool_size_per_thread": 10,
  "database": 0,
  "websockets": false,
  "http_max_request_size": 134217728,
  "verbosity": 4,
  "acl": [
    {
      "disabled": [
        "DEBUG"
      ]
    },
    {
      "http_basic_auth": "user:password",
      "enabled": [
        "DEBUG"
      ]
    }
  ]
}
